{
  "artifact_type": "candidate-manifest",
  "manifest_id": "CM-RB-C01",
  "bundle_plan_sha256": "ffffffffffffffffffffffffffffffffffffffffffffffffffffffffffffffff",
  "character_id": "C01",
  "identity_contract_sha256": "ffffffffffffffffffffffffffffffffffffffffffffffffffffffffffffffff",
  "candidates": [],
  "inspection_status": "pending",
  "candidate_manifest_sha256": "bb7c94ded8d20a5f5e1a18e3621169310fcdf82ad337945f908c46e4bc61e32a"
}
